{
    "schema_version": "1",
    "producer": {
        "name": "elyseum-cli",
        "version": "1.0.0"
    },
    "run": {
        "provider": "github",
        "run_id": "123",
        "attempt": 1,
        "started_at": "2026-09-19T10:00:00.123Z",
        "finished_at": "2026-09-19t10:04:31.123456789+02:00"
    },
    "commit": {
        "sha": "9f2c7a1b8e4d5f6a7b8c9d0e1f2a3b4c5d6e7f80",
        "branch": "main"
    },
    "tests": {
        "total": 7
    },
    "coverage": {}
}
