{
    "schema_version": "1",
    "producer": {"name": "elyseum-cli", "version": "1.0.0"},
    "run": {"provider": "github", "run_id": "1234567890", "attempt": 1},
    "commit": {"sha": "9f2c7a1b8e4d5f6a7b8c9d0e1f2a3b4c5d6e7f80", "branch": "main"},
    "coverage": {"line_percent": 84.7, "function_percent": null, "branch_percent": null}
}
